{
  "eventType": "risk.score.updated",
  "riskScoreId": "44444444-4444-4444-8444-444444444444",
  "userId": "33333333-3333-4333-8333-333333333333",
  "score": 92,
  "level": "CRITICAL",
  "factors": {
    "portfolioConcentration": 48.5,
    "volatility": 22.1,
    "drawdown": 14.8
  },
  "correlationId": "demo-surveillance-risk-breach"
}
